data/combo_daily_append.json

[
  {
    "location": "London",
    "latitude": 51.5,
    "longitude": -0.0,
    "date": "2026-07-01",
    "temperature_2m_max": 25.4
  },
  {
    "location": "London",
    "latitude": 51.5,
    "longitude": -0.0,
    "date": "2026-07-02",
    "temperature_2m_max": 26.2
  },
  {
    "location": "Paris",
    "latitude": 49.0,
    "longitude": 2.0,
    "date": "2026-07-01",
    "temperature_2m_max": 22.5
  },
  {
    "location": "Paris",
    "latitude": 49.0,
    "longitude": 2.0,
    "date": "2026-07-02",
    "temperature_2m_max": 23.4
  },
  {
    "location": "Rome",
    "latitude": 42.0,
    "longitude": 12.5,
    "date": "2026-07-01",
    "temperature_2m_max": 35.4
  },
  {
    "location": "Rome",
    "latitude": 42.0,
    "longitude": 12.5,
    "date": "2026-07-02",
    "temperature_2m_max": 30.6
  },
  {
    "location": "Edinburgh",
    "latitude": 56.0,
    "longitude": -3.25,
    "date": "2026-07-01",
    "temperature_2m_max": 19.4
  },
  {
    "location": "Edinburgh",
    "latitude": 56.0,
    "longitude": -3.25,
    "date": "2026-07-02",
    "temperature_2m_max": 18.0
  }
]

README.md

##london uses greenwich

https://archive-api.open-meteo.com/v1/archive?latitude=51.5&longitude=-0.0&start_date=2026-01-01&end_date=2026-06-30&daily=temperature_2m_max&timezone=auto

##paris uses versailles

https://archive-api.open-meteo.com/v1/archive?latitude=49.0&longitude=2.0&start_date=1940-01-01&end_date=1979-12-31&daily=temperature_2m_max&timezone=auto

##rome is just a few miles north of rome

https://archive-api.open-meteo.com/v1/archive?latitude=42.0&longitude=12.5&start_date=1940-01-01&end_date=2026-06-30&daily=temperature_2m_max&timezone=auto

##edinburgh

https://archive-api.open-meteo.com/v1/archive?latitude=56.0&longitude=-3.25&start_date=1940-01-01&end_date=2026-06-30&daily=temperature_2m_max&timezone=auto

##stockholm

https://archive-api.open-meteo.com/v1/archive?latitude=59.25&longitude=18.0&start_date=1940-01-01&end_date=2026-06-30&daily=temperature_2m_max&timezone=auto